{
  "$schema": "https://json-schema.org/draft/2020-12/schema",
  "$id": "https://souroldgeezer.dev/schemas/architecture/layout-request.schema.json",
  "title": "Architecture layout request",
  "type": "object",
  "required": ["schemaVersion", "requestId", "archimateTarget", "mode", "view", "nodes", "edges", "constraints"],
  "additionalProperties": true,
  "properties": {
    "schemaVersion": { "const": "1.0" },
    "requestId": { "type": "string", "minLength": 1 },
    "archimateTarget": { "const": "3.2" },
    "mode": { "enum": ["generated-layout", "route-repair", "global-polish"] },
    "preserveExistingGeometry": { "type": "boolean" },
    "view": {
      "type": "object",
      "required": ["id", "name", "viewpoint", "direction", "qualityTarget"],
      "additionalProperties": true,
      "properties": {
        "id": { "type": "string", "minLength": 1 },
        "name": { "type": "string", "minLength": 1 },
        "viewpoint": { "type": "string", "minLength": 1 },
        "direction": { "enum": ["DOWN", "RIGHT", "LEFT", "UP"] },
        "qualityTarget": { "enum": ["diagram-readable", "review-ready"] }
      }
    },
    "nodes": {
      "type": "array",
      "minItems": 1,
      "items": {
        "type": "object",
        "required": ["id", "width", "height"],
        "additionalProperties": true,
        "properties": {
          "id": { "type": "string", "minLength": 1 },
          "elementRef": { "type": "string", "minLength": 1 },
          "type": { "type": "string", "minLength": 1 },
          "semanticLayer": { "type": "string", "minLength": 1 },
          "semanticAspect": { "type": "string", "minLength": 1 },
          "label": { "type": "string" },
          "width": { "type": "integer", "minimum": 1 },
          "height": { "type": "integer", "minimum": 1 },
          "x": { "type": "integer" },
          "y": { "type": "integer" },
          "locked": { "type": "boolean" },
          "generated": { "type": "boolean" },
          "inferred": { "type": "boolean" },
          "parentId": { "type": "string", "minLength": 1 },
          "ports": {
            "type": "array",
            "items": {
              "type": "object",
              "additionalProperties": true,
              "properties": {
                "id": { "type": "string", "minLength": 1 },
                "side": { "type": "string", "minLength": 1 },
                "offset": { "type": "integer" },
                "x": { "type": "integer" },
                "y": { "type": "integer" }
              }
            }
          }
        }
      }
    },
    "edges": {
      "type": "array",
      "items": {
        "type": "object",
        "required": ["id", "source", "target"],
        "additionalProperties": true,
        "properties": {
          "id": { "type": "string", "minLength": 1 },
          "relationshipRef": { "type": "string", "minLength": 1 },
          "relationshipType": { "type": "string", "minLength": 1 },
          "type": { "type": "string", "minLength": 1 },
          "source": { "type": "string", "minLength": 1 },
          "target": { "type": "string", "minLength": 1 },
          "visible": { "type": "boolean" },
          "priority": { "type": "integer" },
          "generated": { "type": "boolean" },
          "locked": { "type": "boolean" },
          "routeLocked": { "type": "boolean" },
          "existingRoute": {
            "type": "array",
            "items": { "$ref": "#/$defs/point" }
          },
          "preferredSourcePorts": {
            "type": "array",
            "items": { "type": "string", "minLength": 1 }
          },
          "preferredTargetPorts": {
            "type": "array",
            "items": { "type": "string", "minLength": 1 }
          },
          "priorBendpoints": {
            "type": "array",
            "items": { "$ref": "#/$defs/point" }
          },
          "curationReason": { "type": "string" }
        }
      }
    },
    "containers": {
      "type": "array",
      "items": {
        "type": "object",
        "required": ["parent", "children"],
        "additionalProperties": true,
        "properties": {
          "parent": { "type": "string", "minLength": 1 },
          "children": {
            "type": "array",
            "minItems": 1,
            "items": { "type": "string", "minLength": 1 }
          },
          "relationshipRef": { "type": "string", "minLength": 1 },
          "relationshipType": { "type": "string", "minLength": 1 },
          "maxDepth": { "type": "integer", "minimum": 1 },
          "mayHideEdge": { "type": "boolean" }
        }
      }
    },
    "locks": {
      "type": "array",
      "items": {
        "type": "object",
        "additionalProperties": true,
        "properties": {
          "node": { "type": "string", "minLength": 1 },
          "edge": { "type": "string", "minLength": 1 },
          "reason": { "type": "string" }
        }
      }
    },
    "priorGeometry": {
      "type": "object",
      "additionalProperties": true,
      "properties": {
        "nodes": {
          "type": "array",
          "items": {
            "type": "object",
            "required": ["id"],
            "additionalProperties": true,
            "properties": {
              "id": { "type": "string", "minLength": 1 },
              "x": { "type": "integer" },
              "y": { "type": "integer" },
              "w": { "type": "integer", "minimum": 1 },
              "h": { "type": "integer", "minimum": 1 }
            }
          }
        },
        "edges": { "type": "array" }
      }
    },
    "semanticBands": {
      "type": "array",
      "items": {
        "type": "object",
        "additionalProperties": true,
        "properties": {
          "id": { "type": "string", "minLength": 1 },
          "axis": { "type": "string", "minLength": 1 },
          "order": { "type": "integer" },
          "role": { "type": "string" }
        }
      }
    },
    "layoutPolicy": {
      "type": "object",
      "required": ["name", "constraints"],
      "additionalProperties": true,
      "properties": {
        "name": { "type": "string", "minLength": 1 },
        "strictness": { "enum": ["warn", "strict"] },
        "constraints": {
          "type": "array",
          "items": {
            "type": "object",
            "required": ["id", "kind"],
            "additionalProperties": true,
            "properties": {
              "id": { "type": "string", "minLength": 1 },
              "kind": { "type": "string", "minLength": 1 },
              "role": { "type": "string", "minLength": 1 },
              "direction": { "enum": ["DOWN", "RIGHT", "LEFT", "UP"] },
              "axis": { "enum": ["x", "y"] },
              "parentId": { "type": "string", "minLength": 1 },
              "nodeIds": {
                "type": "array",
                "items": { "type": "string", "minLength": 1 }
              },
              "edgeIds": {
                "type": "array",
                "items": { "type": "string", "minLength": 1 }
              },
              "pairs": {
                "type": "array",
                "items": {
                  "type": "object",
                  "required": ["upper", "lower"],
                  "additionalProperties": true,
                  "properties": {
                    "upper": { "type": "string", "minLength": 1 },
                    "lower": { "type": "string", "minLength": 1 }
                  }
                }
              }
            }
          }
        }
      }
    },
    "constraints": {
      "type": "object",
      "additionalProperties": true,
      "properties": {
        "noRoutePossible": { "type": "boolean" },
        "maxNodeDisplacement": { "type": "integer", "minimum": 0 },
        "maxBends": { "type": "integer", "minimum": 0 }
      }
    }
  },
  "$defs": {
    "point": {
      "type": "object",
      "required": ["x", "y"],
      "additionalProperties": true,
      "properties": {
        "x": { "type": "integer" },
        "y": { "type": "integer" }
      }
    }
  }
}
