{
  "schemaVersion": "1.0",
  "requestId": "elk-service-realization",
  "archimateTarget": "3.2",
  "mode": "generated-layout",
  "view": { "id": "v-elk-sr", "name": "Service Realization", "viewpoint": "Service Realization", "direction": "DOWN", "qualityTarget": "review-ready" },
  "nodes": [
    { "id": "component", "label": "Component", "width": 140, "height": 70, "generated": true },
    { "id": "service", "label": "Service", "width": 140, "height": 70, "generated": true },
    { "id": "process", "label": "Process", "width": 140, "height": 70, "generated": true }
  ],
  "edges": [
    { "id": "e1", "source": "component", "target": "service", "visible": true, "priority": 8 },
    { "id": "e2", "source": "service", "target": "process", "visible": true, "priority": 9 }
  ],
  "constraints": { "orthogonalRouting": true, "avoidNodeBodies": true, "visibleRealizationSpine": true }
}
