{
  "schemaVersion": "1.0",
  "requestId": "route-simple-obstacle",
  "archimateTarget": "3.2",
  "mode": "route-repair",
  "view": { "id": "v-route", "name": "Route Repair", "viewpoint": "Service Realization", "direction": "RIGHT", "qualityTarget": "review-ready" },
  "nodes": [
    { "id": "source", "width": 100, "height": 60, "x": 40, "y": 80, "locked": true },
    { "id": "obstacle", "width": 100, "height": 90, "x": 220, "y": 65, "locked": true },
    { "id": "target", "width": 100, "height": 60, "x": 420, "y": 80, "locked": true }
  ],
  "edges": [{ "id": "route", "source": "source", "target": "target", "visible": true, "priority": 10 }],
  "constraints": { "orthogonalRouting": true, "avoidNodeBodies": true, "parallelEdgeSeparation": 24 }
}
