{
  "schemaVersion": "1.0",
  "requestId": "realistic-technology-usage-hosting-stack",
  "archimateTarget": "3.2",
  "mode": "generated-layout",
  "view": {
    "id": "id-view-realistic-technology-usage",
    "name": "Signup Hosting Stack",
    "viewpoint": "Technology Usage",
    "direction": "DOWN",
    "qualityTarget": "diagram-readable"
  },
  "nodes": [
    {
      "id": "id-node-static-site-host",
      "label": "Static Site Host",
      "width": 260,
      "height": 150,
      "generated": true,
      "x": 40,
      "y": 40,
      "locked": true
    },
    {
      "id": "id-node-spa-artifact",
      "label": "Signup SPA Artifact",
      "width": 190,
      "height": 60,
      "parentId": "id-node-static-site-host",
      "generated": true,
      "x": 80,
      "y": 110,
      "locked": true
    },
    {
      "id": "id-node-compute-plan",
      "label": "Compute Plan",
      "width": 400,
      "height": 360,
      "generated": true,
      "x": 380,
      "y": 40,
      "locked": true
    },
    {
      "id": "id-node-function-app",
      "label": "Signup Function App",
      "width": 310,
      "height": 240,
      "parentId": "id-node-compute-plan",
      "generated": true,
      "x": 430,
      "y": 120,
      "locked": true
    },
    {
      "id": "id-node-function-runtime",
      "label": "Managed Runtime",
      "width": 210,
      "height": 60,
      "parentId": "id-node-function-app",
      "generated": true,
      "x": 480,
      "y": 180,
      "locked": true
    },
    {
      "id": "id-node-function-package",
      "label": "Signup Package",
      "width": 210,
      "height": 60,
      "parentId": "id-node-function-app",
      "generated": true,
      "x": 480,
      "y": 270,
      "locked": true
    },
    {
      "id": "id-node-document-db",
      "label": "Document Database",
      "width": 220,
      "height": 70,
      "generated": true,
      "x": 860,
      "y": 60,
      "locked": true
    },
    {
      "id": "id-node-object-storage",
      "label": "Object Storage",
      "width": 220,
      "height": 70,
      "generated": true,
      "x": 860,
      "y": 170,
      "locked": true
    },
    {
      "id": "id-node-secret-vault",
      "label": "Secret Vault",
      "width": 220,
      "height": 70,
      "generated": true,
      "x": 860,
      "y": 280,
      "locked": true
    },
    {
      "id": "id-node-telemetry-workspace",
      "label": "Telemetry Workspace",
      "width": 230,
      "height": 70,
      "generated": true,
      "x": 1140,
      "y": 170,
      "locked": true
    }
  ],
  "edges": [
    {
      "id": "id-conn-static-serves-function",
      "source": "id-node-static-site-host",
      "target": "id-node-function-app",
      "visible": true,
      "priority": 9
    },
    {
      "id": "id-conn-function-uses-document-db",
      "source": "id-node-function-app",
      "target": "id-node-document-db",
      "visible": true,
      "priority": 8
    },
    {
      "id": "id-conn-function-uses-object-storage",
      "source": "id-node-function-app",
      "target": "id-node-object-storage",
      "visible": true,
      "priority": 7
    },
    {
      "id": "id-conn-vault-serves-function",
      "source": "id-node-secret-vault",
      "target": "id-node-function-app",
      "visible": true,
      "priority": 6
    },
    {
      "id": "id-conn-telemetry-serves-function",
      "source": "id-node-telemetry-workspace",
      "target": "id-node-function-app",
      "visible": true,
      "priority": 5
    }
  ],
  "constraints": {
    "orthogonalRouting": true,
    "avoidNodeBodies": true,
    "preserveContainment": true
  }
}
