{
  "schemaVersion": "1.0",
  "requestId": "route-parallel",
  "archimateTarget": "3.2",
  "mode": "route-repair",
  "view": { "id": "v-parallel", "name": "Parallel", "viewpoint": "Application Cooperation", "direction": "RIGHT", "qualityTarget": "diagram-readable" },
  "nodes": [
    { "id": "a", "width": 100, "height": 60, "x": 40, "y": 40 },
    { "id": "b", "width": 100, "height": 60, "x": 340, "y": 40 }
  ],
  "edges": [
    { "id": "e1", "source": "a", "target": "b", "visible": true, "priority": 1 },
    { "id": "e2", "source": "a", "target": "b", "visible": true, "priority": 1 }
  ],
  "constraints": { "orthogonalRouting": true, "parallelEdgeSeparation": 24 }
}
