{
  "schemaVersion": "1.0",
  "requestId": "polish-none",
  "archimateTarget": "3.2",
  "mode": "global-polish",
  "view": { "id": "v-polish-none", "name": "Polish None", "viewpoint": "Technology Usage", "direction": "DOWN", "qualityTarget": "diagram-readable" },
  "nodes": [
    { "id": "a", "width": 100, "height": 60, "x": 40, "y": 40, "locked": true },
    { "id": "b", "width": 100, "height": 60, "x": 260, "y": 40, "locked": true }
  ],
  "edges": [{ "id": "e1", "source": "a", "target": "b", "visible": true }],
  "constraints": { "maxNodeDisplacement": 0 }
}
