{
  "schemaVersion": "1.0",
  "requestId": "polish-locked",
  "archimateTarget": "3.2",
  "mode": "global-polish",
  "view": { "id": "v-polish-locked", "name": "Polish Locked", "viewpoint": "Service Realization", "direction": "DOWN", "qualityTarget": "review-ready" },
  "nodes": [
    { "id": "locked-a", "width": 120, "height": 70, "x": 40, "y": 40, "locked": true },
    { "id": "locked-b", "width": 120, "height": 70, "x": 200, "y": 40, "locked": true }
  ],
  "edges": [{ "id": "e1", "source": "locked-a", "target": "locked-b", "visible": true }],
  "constraints": { "maxNodeDisplacement": 40 }
}
