{
  "schemaVersion": "1.0",
  "requestId": "polish-overlap",
  "archimateTarget": "3.2",
  "mode": "global-polish",
  "view": { "id": "v-polish-overlap", "name": "Polish Overlap", "viewpoint": "Service Realization", "direction": "DOWN", "qualityTarget": "review-ready" },
  "nodes": [
    { "id": "locked", "width": 120, "height": 70, "x": 40, "y": 40, "locked": true },
    { "id": "move-a", "width": 120, "height": 70, "x": 200, "y": 40, "generated": true },
    { "id": "move-b", "width": 120, "height": 70, "x": 210, "y": 50, "generated": true }
  ],
  "edges": [
    { "id": "e1", "source": "locked", "target": "move-a", "visible": true },
    { "id": "e2", "source": "move-a", "target": "move-b", "visible": true }
  ],
  "constraints": { "maxNodeDisplacement": 90, "orthogonalRouting": true, "avoidNodeBodies": true }
}
