{
  "schemaVersion": "1.0",
  "requestId": "route-none",
  "archimateTarget": "3.2",
  "mode": "route-repair",
  "view": { "id": "v-no-route", "name": "No Route", "viewpoint": "Service Realization", "direction": "RIGHT", "qualityTarget": "diagram-readable" },
  "nodes": [
    { "id": "a", "width": 100, "height": 60, "x": 40, "y": 40 },
    { "id": "b", "width": 100, "height": 60, "x": 340, "y": 40 }
  ],
  "edges": [{ "id": "blocked", "source": "a", "target": "b", "visible": true }],
  "constraints": { "noRoutePossible": true }
}
