{
  "schemaVersion": "1.0",
  "requestId": "polish-connector",
  "archimateTarget": "3.2",
  "mode": "global-polish",
  "view": { "id": "v-polish-connector", "name": "Polish Connector", "viewpoint": "Application Cooperation", "direction": "RIGHT", "qualityTarget": "review-ready" },
  "nodes": [
    { "id": "a", "width": 100, "height": 60, "x": 40, "y": 80 },
    { "id": "middle", "width": 100, "height": 80, "x": 220, "y": 70, "generated": true },
    { "id": "b", "width": 100, "height": 60, "x": 420, "y": 80 }
  ],
  "edges": [{ "id": "e1", "source": "a", "target": "b", "visible": true }],
  "constraints": { "maxNodeDisplacement": 80, "orthogonalRouting": true, "avoidNodeBodies": true }
}
