{
  "schemaVersion": "1.0",
  "requestId": "route-locked-valid",
  "archimateTarget": "3.2",
  "mode": "route-repair",
  "view": { "id": "v-locked-valid", "name": "Locked Valid", "viewpoint": "Service Realization", "direction": "RIGHT", "qualityTarget": "diagram-readable" },
  "nodes": [
    { "id": "a", "width": 100, "height": 60, "x": 40, "y": 40 },
    { "id": "b", "width": 100, "height": 60, "x": 340, "y": 40 }
  ],
  "edges": [{ "id": "locked", "source": "a", "target": "b", "visible": true, "routeLocked": true, "existingRoute": [{ "x": 180, "y": 70 }, { "x": 280, "y": 70 }] }],
  "constraints": { "orthogonalRouting": true, "avoidNodeBodies": true }
}
